{
  "meta": {
    "title": "שאלון מנועי המחוברות",
    "description": "מהו מנוע המחוברות שמניע אותך? - שאלון קווין קרוז"
  },
  "intro": {
    "title": "מהו מנוע המחוברות שמניע אותך?",
    "instructions": "להלן שאלון קצר שיעזור לך להבין מהו מנוע המחוברות שלך, כלומר מהו הדבר שמייצר אצלך מחוברות למקום העבודה.",
    "scaleExplanation": "לגבי ההצהרות שלהלן יש לענות באמצעות המפתח הבא:",
    "scaleLabels": {
      "1": "לחלוטין לא מסכים",
      "2": "לא מסכים",
      "3": "ניטרלי",
      "4": "מסכים",
      "5": "מסכים לחלוטין"
    }
  },
  "ui": {
    "start": "התחל",
    "next": "הבא",
    "prev": "חזרה",
    "backToIntro": "חזרה להנחיות",
    "finish": "סיום",
    "toResults": "לתוצאות",
    "copyResults": "העתק תוצאות",
    "restart": "התחל מחדש",
    "backToHub": "חזרה למרכז השאלונים",
    "backToQuestions": "חזרה לשאלות",
    "questionOf": "שאלה {current} מתוך {total}",
    "fillRandom": "מילוי אקראי (בדיקה)"
  },
  "questions": [
    {
      "id": 1,
      "text": "חשוב להיפגש עם המנהל 1:1 לפחות אחת לשבוע",
      "category": "communication"
    },
    {
      "id": 2,
      "text": "חשוב שתתקיים פגישת צוות/ישיבת צוות לפחות אחת לשבוע",
      "category": "communication"
    },
    {
      "id": 3,
      "text": "אני נהנה מקריאת עדכונים על הנעשה בחברה",
      "category": "communication"
    },
    {
      "id": 4,
      "text": "חשוב שהמנכ\"ל או מנהלים בכירים ישוחחו עם העובדים",
      "category": "communication"
    },
    {
      "id": 5,
      "text": "אני משקיע בתכנון הקריירה שלי",
      "category": "growth"
    },
    {
      "id": 6,
      "text": "אני אוהב ללמוד דברים חדשים ולעמוד באתגרים בעבודה",
      "category": "growth"
    },
    {
      "id": 7,
      "text": "הייתי רוצה שיהיה לי מנטור בחברה שידריך אותי לגבי הקריירה שלי",
      "category": "growth"
    },
    {
      "id": 8,
      "text": "חשוב לי לדעת מהו \"הצעד הבא\" בקריירה שלי",
      "category": "growth"
    },
    {
      "id": 9,
      "text": "אני מרגיש טוב כשמנהל אומר לי \"תודה\"",
      "category": "recognition"
    },
    {
      "id": 10,
      "text": "אני מרגיש טוב כשעמית אומר לי \"תודה\"",
      "category": "recognition"
    },
    {
      "id": 11,
      "text": "אני מרגיש טוב כשמיישמים רעיון שלי בעבודה",
      "category": "recognition"
    },
    {
      "id": 12,
      "text": "אני מרגיש טוב כשמתייעצים איתי בעבודה",
      "category": "recognition"
    },
    {
      "id": 13,
      "text": "חשוב לי להכיר את מטרות הארגון",
      "category": "trust"
    },
    {
      "id": 14,
      "text": "חשוב לי לדעת איך העבודה שלי תורמת להשגת מטרות הארגון",
      "category": "trust"
    },
    {
      "id": 15,
      "text": "חשוב לי שלמנהל שלי יהיה אכפת ממני",
      "category": "trust"
    },
    {
      "id": 16,
      "text": "חשוב שהנהלת הארגון תבצע בפועל את מה שמצהירה שתעשה",
      "category": "trust"
    }
  ],
  "categories": [
    {
      "id": "communication",
      "title": "תקשורת",
      "questions": [1, 2, 3, 4],
      "description": "תקשורת היא מנוע המחוברות שלך. כדי להרגיש מחוברות, חשוב שתהיה תקשורת שוטפת עם המנהל, הצוות והנהלת הארגון."
    },
    {
      "id": "growth",
      "title": "צמיחה והתפתחות",
      "questions": [5, 6, 7, 8],
      "description": "צמיחה והתפתחות היא מנוע המחוברות שלך. כדי להרגיש מחוברות, חשוב שתהיה לך הזדמנות לצמוח, ללמוד ולהתפתח בקריירה."
    },
    {
      "id": "recognition",
      "title": "הכרה והוקרה",
      "questions": [9, 10, 11, 12],
      "description": "הכרה והוקרה היא מנוע המחוברות שלך. כדי להרגיש מחוברות, חשוב שתקבל הכרה והוקרה על התרומה שלך מהמנהל, העמיתים והארגון."
    },
    {
      "id": "trust",
      "title": "אמון ובטחון",
      "questions": [13, 14, 15, 16],
      "description": "אמון ובטחון הוא מנוע המחוברות שלך. כדי להרגיש מחוברות, חשוב שתהיה לך בהירות לגבי מטרות הארגון ותחושת אמון שהארגון עומד בהבטחותיו."
    }
  ],
  "results": {
    "title": "התוצאות שלך",
    "subtitle": "סכום את הציון שהתקבל לגבי כל מנוע",
    "highestDriver": "המנוע שקיבל את הציון הגבוה מבין הארבעה הינו מנוע המחוברות שלך!",
    "highestDriverNote": "כלומר, כדי להרגיש \"מחוברות\" יש להביא עקרון זה לידי ביטוי יומיומי בסביבת העבודה שלך.",
    "sharedResponsibility": "זוהי אחריות משותפת למנהל שלך ולך!!!",
    "actionPlan": "חשוב ביותר לתקשר דבר זה עם המנהל שלך ולחשוב ביחד איך ממקסמים אלמנט זה ומביאים אותו לביטוי בעבודתך",
    "multipleDrivers": "אם קיבלת כמה מנועים דומים בעוצמתם, זוהי בשורה טובה! יש לך כמה מנועי מחוברות ולכן סביר גם שיהיה לך קל יותר להגיע למחוברות למקום העבודה. בתכנית הפעולה שלך שלב את כל האלמנטים.",
    "lowScores": "אם כל הציונים שקיבלת הינם מתחת ל-12, המשמעות הינה שאתה ניטרלי או למטה מזה לגבי כל המנועים. הסיבה נעוצה בכך שכנראה מנועי המחוברות שלך הינם שונים.",
    "lowScoresAction": "במקרה זה יש לחשוב על השאלה: מה חשוב לי במקום העבודה? נסה לחשוב על מקום עבודה מהעבר בו הרגשת מחובר באמת, מה היה העיקרון או האלמנטים שיצרו מחוברות זו? איך ניתן לייצר אותם במקום העבודה הנוכחי? שתף את המנהל שלך ובנה תכנית פעולה.",
    "worthIt": "זה שווה את ההשקעה כי (עפ\"י מחקרים) מחוברות = אושר!"
  },
  "markdown": {
    "title": "תוצאות שאלון מנועי המחוברות",
    "categoryScores": "ציונים לפי קטגוריה",
    "yourDriver": "מנוע המחוברות שלך",
    "scoreLabel": "ציון"
  }
}
