{
  "meta": {
    "title": "שאלון אומץ - מנועי ההשפעה וההובלה",
    "description": "אבחון עצמי של מנועי ההשפעה וההובלה שלך (Klein & Klein 2012)"
  },
  "intro": {
    "title": "שאלון אומץ - מנועי ההשפעה וההובלה",
    "instructions": "לפניך 30 שאלות. לכל שאלה יש לענות באמצעות המפתח הבא:",
    "scaleLabels": {
      "1": "בכלל לא",
      "2": "במידה מועטה",
      "3": "במידה בינונית",
      "4": "במידה רבה",
      "5": "במידה רבה מאוד"
    },
    "note": "אין תשובות נכונות או לא נכונות - חשוב לסמן את מה שאתה ומי שאתה באמת, לא את מה שאתה רוצה שיחשבו עליך."
  },
  "ui": {
    "start": "התחל",
    "next": "הבא",
    "prev": "חזרה",
    "backToIntro": "חזרה להנחיות",
    "finish": "סיום",
    "toResults": "לתוצאות",
    "toAnalysis": "ניתוח מפורט",
    "copyResults": "העתק תוצאות",
    "restart": "התחל מחדש",
    "backToHub": "חזרה למרכז השאלונים",
    "backToQuestions": "חזרה לשאלות",
    "backToResults": "חזרה לתוצאות",
    "questionOf": "שאלה {current} מתוך {total}",
    "fillRandom": "מילוי אקראי (בדיקה)"
  },
  "questions": [
    {
      "id": 1,
      "text": "אני משרה אופטימיות ואנרגיות חיוביות על הסביבה שלי"
    },
    {
      "id": 2,
      "text": "אני משקיע בבניית יחסים אמון עם אנשים סביבי"
    },
    {
      "id": 3,
      "text": "אני מציב לעצמי יעדים שאפתניים ומתמקד בהשגתם"
    },
    {
      "id": 4,
      "text": "אני מגדיר מטרות ברורות ומתכנן את הדרך להשגתן"
    },
    {
      "id": 5,
      "text": "אני עובד בצורה מסודרת ומתוכננת"
    },
    {
      "id": 6,
      "text": "אני מעורר השראה והתלהבות אצל אחרים"
    },
    {
      "id": 7,
      "text": "אני מחויב ליחסים ארוכי טווח עם אנשים"
    },
    {
      "id": 8,
      "text": "אני ממוקד בהשגת היעדים שהצבתי לעצמי"
    },
    {
      "id": 9,
      "text": "אני מקפיד על משמעת עצמית ועל סדר בעבודה"
    },
    {
      "id": 10,
      "text": "אני פתוח לקבל משוב ולשתף במשוב שלי"
    },
    {
      "id": 11,
      "text": "אני יוצר התלהבות ואנרגיה חיובית בקבוצה"
    },
    {
      "id": 12,
      "text": "אני בונה אמון ומחויבות ביחסים עם אחרים"
    },
    {
      "id": 13,
      "text": "אני מתמקד ביעדים ארוכי טווח ומקדם אותם"
    },
    {
      "id": 14,
      "text": "אני מקפיד על עבודה מסודרת ומתוכננת"
    },
    {
      "id": 15,
      "text": "אני פתוח לשיח כן ולקבלת משוב"
    },
    {
      "id": 16,
      "text": "אני משרה אופטימיות ותקווה בסביבתי"
    },
    {
      "id": 17,
      "text": "אני משקיע זמן ומאמץ בבניית יחסים משמעותיים"
    },
    {
      "id": 18,
      "text": "אני מקפיד על משמעת וסדר בעבודה שלי"
    },
    {
      "id": 19,
      "text": "אני פתוח לשיח כן ולחלוקת מחשבותיי"
    },
    {
      "id": 20,
      "text": "אני מעודד פתיחות ותקשורת כן בסביבתי"
    },
    {
      "id": 21,
      "text": "אני יוצר אנרגיה חיובית והתלהבות בקבוצה"
    },
    {
      "id": 22,
      "text": "אני מחויב להעצים אחרים ולבנות יחסים חזקים"
    },
    {
      "id": 23,
      "text": "אני מגדיר יעדים שאפתניים ומתמקד בהשגתם"
    },
    {
      "id": 24,
      "text": "אני מקפיד על עבודה מסודרת ומתוכננת"
    },
    {
      "id": 25,
      "text": "אני פתוח לקבל משוב קשה ולשתף במשוב שלי"
    },
    {
      "id": 26,
      "text": "אני מתמקד ביעדים ארוכי טווח ומקדם אותם באופן עקבי"
    },
    {
      "id": 27,
      "text": "אני מעודד פתיחות ותקשורת כן בסביבתי"
    },
    {
      "id": 28,
      "text": "אני משקיע בבניית יחסים אמון ומחויבות עם אחרים"
    },
    {
      "id": 29,
      "text": "אני משרה אופטימיות והתלהבות על הסביבה שלי"
    },
    {
      "id": 30,
      "text": "אני מקפיד על משמעת עצמית וסדר בעבודה"
    }
  ],
  "categories": [
    {
      "id": "goal-orientation",
      "title": "מכוונות ליעדים",
      "questions": [3, 4, 8, 13, 23, 26],
      "description": "האומץ להציב ולהשיג יעדים שאפתניים",
      "scoreRange": [6, 30],
      "interpretation": {
        "low": "ציון נמוך (6-15): יש מקום לשיפור בהצבת יעדים שאפתניים ובמיקוד בהשגתם.",
        "medium": "ציון בינוני (16-22): יש לך יכולת להציב יעדים, אך ניתן לחזק את המיקוד והעקביות בהשגתם.",
        "high": "ציון גבוה (23-30): את/ה מצטיין/ת בהצבת יעדים שאפתניים ובמיקוד עקבי בהשגתם."
      }
    },
    {
      "id": "inspiration",
      "title": "השראה והתלהבות",
      "questions": [1, 6, 11, 16, 21, 29],
      "description": "האומץ להשרות אופטימיות ואנרגיות חיוביות",
      "scoreRange": [6, 30],
      "interpretation": {
        "low": "ציון נמוך (6-15): יש מקום לשיפור ביכולת להשרות אופטימיות ואנרגיות חיוביות.",
        "medium": "ציון בינוני (16-22): יש לך יכולת להשרות השראה, אך ניתן לחזק את ההשפעה החיובית שלך.",
        "high": "ציון גבוה (23-30): את/ה מצטיין/ת בהשראה והתלהבות, ויוצר/ת אנרגיה חיובית בסביבתך."
      }
    },
    {
      "id": "relationships",
      "title": "מחויבות ליחסים",
      "questions": [2, 7, 12, 17, 22, 28],
      "description": "האומץ להעצים, ליצור אמון ולהשקיע בבניית יחסים",
      "scoreRange": [6, 30],
      "interpretation": {
        "low": "ציון נמוך (6-15): יש מקום לשיפור בהשקעה בבניית יחסים ובהעצמת אחרים.",
        "medium": "ציון בינוני (16-22): יש לך יכולת לבנות יחסים, אך ניתן לחזק את המחויבות וההשקעה.",
        "high": "ציון גבוה (23-30): את/ה מצטיין/ת בבניית יחסים אמון ובהעצמת אחרים."
      }
    },
    {
      "id": "openness",
      "title": "פתיחות",
      "questions": [10, 15, 19, 20, 25, 27],
      "description": "האומץ לקבל ולתת משוב פתוח וכן",
      "scoreRange": [6, 30],
      "interpretation": {
        "low": "ציון נמוך (6-15): יש מקום לשיפור בפתיחות לקבלת משוב ובשיתוף כן.",
        "medium": "ציון בינוני (16-22): יש לך יכולת לפתיחות, אך ניתן לחזק את הנכונות לקבל ולתת משוב.",
        "high": "ציון גבוה (23-30): את/ה מצטיין/ת בפתיחות, בקבלת משוב ובשיתוף כן."
      }
    },
    {
      "id": "rigor",
      "title": "קפדנות ומשמעת",
      "questions": [5, 9, 14, 18, 24, 30],
      "description": "האומץ לעבוד בצורה מסודרת ומתוכננת",
      "scoreRange": [6, 30],
      "interpretation": {
        "low": "ציון נמוך (6-15): יש מקום לשיפור בעבודה מסודרת ומתוכננת.",
        "medium": "ציון בינוני (16-22): יש לך יכולת לעבודה מסודרת, אך ניתן לחזק את המשמעת והקפדנות.",
        "high": "ציון גבוה (23-30): את/ה מצטיין/ת בעבודה מסודרת ומתוכננת, עם משמעת עצמית גבוהה."
      }
    }
  ],
  "results": {
    "title": "התוצאות שלך",
    "subtitle": "ציונים לפי מנועי השפעה",
    "dominantDrivers": "מנועי ההשפעה הדומיננטיים שלך",
    "note": "סכמו את הציון בכל מנוע. המנוע שקיבל את הציון הגבוה ביותר הוא מנוע ההשפעה הדומיננטי שלך."
  },
  "analysis": {
    "title": "ניתוח מפורט",
    "subtitle": "פירוט לפי מנועי השפעה",
    "dominantTitle": "מנועי השפעה דומיננטיים",
    "developmentTitle": "אזורי פיתוח"
  },
  "markdown": {
    "title": "תוצאות שאלון אומץ - מנועי ההשפעה וההובלה",
    "categoryScores": "ציונים לפי מנועי השפעה",
    "dominantDrivers": "מנועי ההשפעה הדומיננטיים",
    "developmentAreas": "אזורי פיתוח",
    "scoreLabel": "ציון",
    "descriptionLabel": "תיאור"
  }
}
